{
  "target": "example.com",
  "generated": "2026-09-01T13:46:42",
  "exposure": {
    "score": 50,
    "band": "HIGH",
    "drivers": [
      [
        "spf_missing",
        25,
        "no SPF record: domain trivially spoofable"
      ],
      [
        "dmarc_missing",
        20,
        "no DMARC policy"
      ],
      [
        "caa_missing",
        5,
        "no CAA record: any CA may issue certificates"
      ]
    ]
  },
  "changes_since_baseline": [],
  "evidence": {
    "target": "example.com",
    "sources": {
      "dns": {
        "ok": true,
        "data": {
          "A": [
            "104.20.23.154",
            "172.66.147.243"
          ],
          "AAAA": [
            "2606:4700:10::6814:179a",
            "2606:4700:10::ac42:93f3"
          ],
          "MX": [
            "0 "
          ],
          "NS": [
            "elliott.ns.cloudflare.com",
            "hera.ns.cloudflare.com"
          ],
          "TXT": [],
          "SOA": [
            "elliott.ns.cloudflare.com. dns.cloudflare.com. 2411783310 10000 2400 604800 1800"
          ],
          "WWW_CNAME": []
        }
      },
      "rdap": {
        "ok": true,
        "data": {
          "status": [
            "client delete prohibited",
            "client transfer prohibited",
            "client update prohibited"
          ],
          "registrar": "RESERVED-Internet Assigned Numbers Authority",
          "registered": "1995-08-14T04:00:00Z",
          "expires": "2027-08-13T04:00:00Z",
          "updated": "2026-08-14T08:01:43Z",
          "nameservers": [
            "ELLIOTT.NS.CLOUDFLARE.COM",
            "HERA.NS.CLOUDFLARE.COM"
          ]
        }
      },
      "tls_certificate": {
        "ok": true,
        "data": {
          "validated_chain": true,
          "issuer": "SSL Corporation",
          "subject_cn": "example.com",
          "not_after": "Oct 27 22:17:21 2026 GMT",
          "days_remaining": 56,
          "expired": false,
          "expiring_soon": false,
          "sans_count": 2,
          "sans_sample": [
            "*.example.com",
            "example.com"
          ]
        }
      },
      "certificate_transparency": {
        "ok": true,
        "data": [
          "as207960 test intermediate - example.com",
          "dev.example.com",
          "m.example.com",
          "m.testexample.com",
          "products.example.com",
          "subjectname@example.com",
          "support.example.com",
          "user@example.com",
          "www.example.com"
        ]
      },
      "wayback_history": {
        "ok": false,
        "error": "TimeoutError: The read operation timed out"
      },
      "ip_resolution": {
        "ok": true,
        "data": [
          {
            "ip": "172.66.147.243",
            "version": 4,
            "private": false
          },
          {
            "ip": "104.20.23.154",
            "version": 4,
            "private": false
          }
        ]
      },
      "email_security": {
        "ok": true,
        "data": {
          "mx_present": true,
          "spf": null,
          "dmarc": null,
          "caa": null,
          "spf_all_pass": false,
          "spf_all_strict": false
        }
      },
      "live_subdomains": {
        "ok": true,
        "data": {
          "resolving_count": 2,
          "resolving": [
            "m.testexample.com",
            "www.example.com"
          ]
        }
      }
    },
    "warnings": [
      "wayback_history failed: The read operation timed out"
    ]
  }
}